{
  "baselineComparisons": [
    {
      "actual": 816,
      "expected": 816,
      "matches": true,
      "metric": "canonicalPlayers"
    },
    {
      "actual": 3392,
      "expected": 3392,
      "matches": true,
      "metric": "playerTeamSeasons"
    },
    {
      "actual": 727,
      "expected": 727,
      "matches": true,
      "metric": "g2Players"
    },
    {
      "actual": 2992,
      "expected": 2992,
      "matches": true,
      "metric": "g2Profiles"
    },
    {
      "actual": 89,
      "expected": 89,
      "matches": true,
      "metric": "nonG2Players"
    },
    {
      "actual": 147,
      "expected": 147,
      "matches": true,
      "metric": "legacyRows"
    }
  ],
  "counts": {
    "activeG2PlayerReviews": 710,
    "approvedPlayerDefaults": 0,
    "approvedSeasonOverrides": 205,
    "blockingG2Players": 710,
    "blockingG2Profiles": 2787,
    "canonicalPlayers": 816,
    "directRosterProfiles": 12,
    "fullyResolvedG2Players": 17,
    "g2Players": 727,
    "g2Profiles": 2992,
    "legacyConflicting": 0,
    "legacyPartiallyVerified": 14,
    "legacyPilotAgrees": 29,
    "legacyPilotAmbiguous": 14,
    "legacyPilotDisagrees": 0,
    "legacyPilotNotCovered": 133,
    "legacyRows": 147,
    "legacySupported": 29,
    "legacyUnverified": 104,
    "manualReviewRosterProfiles": 0,
    "nonG2BacklogItems": 89,
    "nonG2Players": 89,
    "playerTeamSeasons": 3392,
    "policyDerivedRosterProfiles": 193,
    "resolvedG2CricketNationProfiles": 169,
    "resolvedG2RosterProfiles": 205,
    "unknownG2CricketNationProfiles": 2823,
    "unknownG2RosterProfiles": 2787,
    "unknownPlayerRosterStatuses": 816,
    "unknownPtsRosterStatuses": 3187
  },
  "errors": [],
  "foundationStatus": "PARTIALLY_POPULATED",
  "g2EligibleIdSetSha256": "c0fa9b89561698b0c50a5dacdd4333293c9a7f2f1018ce291f1023d13c6281f3",
  "g2GameInputReady": false,
  "metadataManifestHash": "6313217438b9fccae27b1d2135ae1cca2f061aa3cbcd1047429300401fc05a91",
  "metadataVersion": "ipl-country-overseas-metadata/v1",
  "schemaVersion": "ipl-country-overseas-validation/v2",
  "status": "passed"
}
